470069	paris	jakarta melintasi terowongan place de ialma dengan kecepatan kilometer per jam saja sudah bikin bulu kuduk merinding jadi terbayang bagaimana horornya kecepatan kendaraan lady diana yang berjalan kilometer per jam hingga maut menjemputnya kota paris menjadi saksi bisu detik detik terakhir kematian lady diana sepuluh tahun lalu di terowongan place de ialma si putri rakyat peoples princess itu tak kuasa melawan sang maut kisah lady diana yang tewas kecelakaan mobil di place de ialma menjadikan terowongan sepanjang kurang lebih meter itu begitu penuh memori hingga saat ini pengemudi taksi yang mengaku imigran asal alzajair langsung mengingatkan cerita terowongan place de ialma ketika reporter irna gustia berkunjung ke paris pada mei ini terowongan tempat lady diana kecelakaan katanya sesaat sebelum memasuki terowongan terowongan place de ialma adalah under pass yang terletak kurang lebih kilometer dari menara eiffel terowongan ini dibagi dua jalur barat dan timur lampu di terowongan itu tidak pernah mati untuk menghindari kecelakaan kendaraan limusin mercedes benz s yang ditumpangi lady diana melintasi terowongan place de ialma pada dinihari agustus seperti banyak diberitakan kecepatan kendaraan lady diana yang disopiri henri paul mencapai kilometer padahal batas kecepatan maksimum ketika melewati terowongan place de i’alma hanya kilometer karena terowongan ini panjangnya tidak lurus tapi agak melengkung sedikit taxi parisien yang ditumpangi reporter saja yang berjalan kilometer sudah terasa lumayan ngebut yang bikin bulu kuduk merinding konon kendaraan lady diana melaju dalam kecepatan tinggi karena dikejar paparazzi yang hendak mengambil gambar kemesraan lady diana dan kekasihnya dodi al fayed sayang si sopir henri paul tidak bisa mengendalikan kendaraannya sehingga menabrak pilar yang memisahkan jalur barat dan timur lady diana pun terluka parah yang kemudian meninggal di rumah sakit dan kekasihnya langsung tewas di tempat hanya trevor rees jones pengawal pribadi dodi yang duduk di depan yang selamat hingga kini setiap sopir taksi di paris banyak yang sekadar mengingatkan para turis bahwa terowongan yang dilintasi adalah terowongan maut lady diana rupanya sosok mantan istri pangeran charles ini begitu hidup di hati semua orang sampai sampai sopir taksi di paris pun terlihat wajib menceritakan tempat tempat terakhir yang didatangi diana di ujung hidupnya kurang lebih satu kilometer sebelum melewati terowongan place de ialma berdiri hotel ritz milik ayah dodi mohammad al fayed pengusaha berdarah mesir yang berkewarganegaraan inggris al fayed salah satu warga kehormatan inggris yang juga memiliki pertokoan mewah harrods hotel ini adalah tempat persinggahan terakhir lady diana beberapa menit sebelum keluar melintasi terowongan place de ialma diana dan dodi rupanya tak tahan terus dikuntit paparazzi di hotel ritz dan kabarnya bermaksud menuju rumah pibadi dodi ibu dari pangeran william dan harry ini pun akhirnya menutup cerita hidupnya di terowongan place de ialma di usia tahun cerita menarik soal lady diana juga temui di bandara heathrow london ketika sedang transit pesawat pada mei ketika memasuki glorius britain toko yang menjual cinderamata khas inggris hanya terdapat gambar lady diana dan putranya pangeran william untuk pajangan sendok perak si pelayan toko mengatakan pihaknya hanya menjual pajangan sendok perak yang bergambar lady diana dan pangeran william saja ketika ditanya kenapa tidak ada yang bergambar pangeran harry dan pangeran charles semua orang lebih suka diana dan william bukan harry apalagi charles jawab si pelayan toko yang membikin bengong
638278	kpk	jakarta gedung kpk sepertinya tak pernah sepi dari kunjungan masyarakat yang menyampaikan dukungan hari ini ada sejumlah aktivis dari bandung yang membawa kain berisikan tanda tangan tanda tangan sebagai simbol dukungan kepada lembaga antikorupsi itu aksi digelar di gedung kpk jalan hr rasuna said kuningan jaksel selasa massa yang datang ini mengatasnamakan dirinya paguyuban musuh koruptor pamor datang dari bandung dan tiba di kpk sekitar pukul wib mereka membentangkan spanduk sejuta tanda tangan sepanjang meter kain putih dengan panjang hampir selapangan sepakbola itu dibentangkan di depan gedung kpk karena begitu panjang kain ini akhirnya dibelokkan masuk dan melingkar hingga ke dalam halaman kpk di bagian atas kain itu tertulis gerakan sejuta tanda tangan rakyat jawa barat mendukung antikorupsi di bagian sisanya dipenuhi oleh ribuan tanda tangan lewat tanda tangan itu pamor ingin memperlihatkan bahwa dukungan rakyat jabar pada kpk untuk memberantas korupsi sangat besar tujuannya kita mendukung apa yang dilakukan oleh kpk termasuk perselisihan kpk dengan polri kata budi eka koordinastor pamor saat ditemui di sela aksi budi menambahkan pamor terbentuk sekitar satu bulan lalu yang anggotanya merupakan orang orang antikorupsi beberapa tokoh tokoh jabar menjadi inisiator pembentukkan pamor di antaranya memet a hakim rudita hartono dan tjetje padmadinata ini tuh kita bagi bagi tidak hanya di bandung tapi juga di garut sukabumi tasik dan cirebon tuturnya aksi ini diikuti puluhan orang yang hadir di lokasi mereka mengaku berasal dari berbagai elemen mulai dari lsm pelajar akademisi hingga warga biasa selain menggelar aksi pada sore harinya perwakilan pamor juga bertemu dengan pimpinan kpk mereka ditemui langsung oleh wakil ketua kpk bambang widjojanto mulai dari siang tadi sebelum zuhur kawan kawan yang berasal dari bandung datang ke kpk menemui pimpinan yang pada intinya mereka berdoa dan dukungan mengajukan berbagai kritik yang ditujukan agar kpk tetap konsisten sesuai dengan uu ujar bambang usai bertemu dengan perwakilan pamor ini
638285	haji	mekkah menteri agama suryadharma ali menyatakan pelaksanaan dan pelayanan haji tahun ini lebih baik dibandingkan tahun sebelumnya dia juga mengakui masih ada beberapa hal yang perlu diperbaiki agar lebih meningkat pelaksanaan haji tahun ini lebih baik di bandingkan tahun sebelumnya terutama saat pelaksanaan wukuf di arafah muzdalifah dan mabit di mina kata suryadharma ali kepada wartawan di mekkah selasa menurut dia jumlah jamaah haji indonesia sebanyak ribu sehingga tidak mudah mengatur ratusan ribu jamaah yang masuk ke arab saudi selama hari hal tersebut merupakan mobilitas yang luar biasa namun tidak ada yang terlantar saat masuk mekkah demikian pula saat di madinah juga tidak ada yang tertinggal semua masuk ke pemondokan dan hotel ini bukan peristiwa sederhana secara serentak pada tanggal oktober puncak wukuf sebanyak jamaah seluruh dunia datang ke arafah walaupun jumlahnya banyak tidak ada satupun yang tertinggal katanya dia mengatakan semangat beribadah jamaah indonesia luar biasa sehingga mengalami kelelahan saat wukuf di arafah dan melempar jumrah serta mabit di mina kondisi kesehatan mereka drop sehingga ada yang dirawat di balai pengobatan haji indonesia bphi menurutnya pelayanan kesahatan sangat baik jamaah yang wafat orang angka itu lebih kecil jika dibandingkan tahun lalu yang mencapai di waktu yang sama sebanyak jamaah dirawat di bphi mudah mudahan sampai akhir pemulangan nanti kami harapkan angka kematian di bawah tahun lalu meski soal usia bukan urusan manusia katanya dia mencontohkan seorang jamaah dari medan sumatera utara berusia berhaji didampingi cucunya berusia tahun namun cucunya meninggal sementara dia masih sehat saat ini itu ketentuan allah yang tidak kita ketahui katanya mengenai pemondokan lanjut dia pihaknya berupaya meningkatkan kualitas pelayanandari tahun ke tahun tahun jarak terjauh dari pemondokan ke masjidil haram jarak terjauh km ring i jarak meter ke bawah sedangkan ring ii jaraknya antara meter tahun jarak berkurang menjadi meter itu terus berubah sehingga jarak terjauh meter katanya dia menambahkan untuk transportasi dari mekkah ke arafah muzdalifah dan mina juga lebih lancar menurutnya lancar bukan berarti bebas macet namun akan dikoreksi agar jamaah lebih cepat mencapai armina memang ada keterlambatan yang disebabkan ketidakdisiplinan sopir bis tidak mengambil jamaah dan bis ditinggalkan sopir kita akan minta pemerintah arab saudi untuk menertibkan sesuai jadwal sehingga jamaah datang lebih cepat pungkas suryadharma ali
471117	kolom	jakarta pt tambang batubara bukit asam tbk pt ba di sumatera selatan merupakan salah satu perusahaan penghasil batu bara terbesar di indonesia dan telah diprivatisasi oleh pemerintah pada tahun melalui penjualan saham perdana ipo sebesar pt ba sendiri mempunyai kapasitas cadangan sebesar miliar ton batubara saat ini yang terangkut baru sekitar juta ton per tahun dari muara enim ke tanjung karang karena keterbatasan operator angkutan batubara pt kereta api indonesia pt ka proses perkembangan terkait dengan pemasaran pt ba memang sangat tergantung pada kapasitas angkutan kereta api dari tanjung enim ke pelabuhan tarahan di lampung dan dermaga kertapati di palembang untuk memenuhi kebutuhan batubara di indonesia yang sebesar juta ton per tahun terhitung mulai angkutan batubara harus lancar untuk itu pt ba harus mencari jalan keluar agar target tersebut tercapai kapasitas terpasang pt ba saat ini sekitar juta tontahun konsumen atau pasar utama pt ba selain ekspor adalah pltu suralaya milik pt indonesia power angkutan batubara pt ba memang sering terhambat sebagai akibat tidak adanya kesepakatan tarif angkut dengan pt ka namun saat ini pt ba telah menyepakati tarif pengangkutan batubara yang diminta pt ka sebesar rp per ton per kilometer sebelumnya tarif angkut batubara hanya sebesar rp ton per km rute tanjung enim kertapati dan rp per ton per km tanjung enim tarahan meski demikian pt ba masih khawatir akan kemampuan pt ka untuk dapat mengangkut hasil penambangan terpasang yang sebesar juta tontahun pertarungan kepentingan di lapanganuntuk mengantisipasi kemungkinan terhambatnya kembali angkutan batubara karena permasalahan tarif angkut yang pada akhirnya akan merugikan konsumen atau negara kementerian bumn atas usul pt ba berkeinginan untuk membentuk joint venture company jv co antara pt ba dengan pt ka pembentukan jv co bertujuan untuk pengelolaan dan pengembangan divisi regional divre iii pt ka di sumatera bagian selatan serta pengangkutan batubara jv co yang diusulkan oleh pt ba ini rencananya akan diberi nama sriwijaya kereta api trans skat dimana komposisi modal diusulkan dari pt ba atau setara rp miliar dan dari pt ka atau setara dengan rp triliun bagi pt ba pembentukan jv co ini memang merupakan bagian dari rencana perseroan untuk menggenjot target volume penjualan batubara sebanyak juta tontahun selain mengusulkan kepada pemerintah untuk pembentukan jv co dengan pt ka ternyata pt ba juga diizinkan oleh pemerintah untuk terlibat menjadi pemegang saham pada proyek pengembangan tambang banko tengah blok timur dan pembangunan jalur kereta api serta pelabuhan railway port bekerjasama dengan investor asing pt ba nantinya hanya mempunyai saham sebesar atau us juta sedangkan transpacific infrastructure development atau us juta dan china railway engineering corporation atau usd juta pertanyaannya mengapa setelah kementerian negara bumn memberikan izin pt ba untuk terlibat pada perusahaan pengembangan jalur kereta api dan pelabuhan masih saja dipaksakan pendirian jv co patut diduga keputusan ini dapat melemahkan pt ka divre iii seharusnya keputusan kementerian negara bumn sesuai dengan perintah uu no tahun tentang perkeretaapian harus memperkuat keberadaan pt ka divre iii terlebih dahulu untuk mampu bersaing dengan operator kereta api swasta dampak pembentukan jv co bagi pt kadampak dari diusulkannya pembentukan jv co oleh kementerian negara bumn dapat memunculkan persoalan baru bagi pt ka sebagai pihak yang mempunyai posisi lemah karena pt ka sebagai pemegang saham mayoritas akan dirugikan karena bisnisnya diambil alih dari divre iii sumbagsel jv co tanpa ada kalaikan bisnis yang memadai seperti amdal dll selain itu pt ka juga baru akan mendapatkan untung setelah – tahun jv co berjalan melalui deviden yang dibagikan itu pun kalau jv co untung pt ba yang sudah tbk tentunya akan lebih likuid dan mempunyai akses lebih besar untuk mencari dana di pasar daripada pt ka dalam pengembangan jv co patut diduga nantinya pt ba akan menjadi pemegang saham mayoritas melalui pembelian atau akuisisi saham pt ka dengan komposisi saham pt ba berada di pasar ada kemungkinan saham tersebut dikuasai oleh investor asing artinya saham mayoritas pt ba di jv co pun secara hukum dapat diambil alih oleh asing melalui bursa sehingga jalur kereta api yang awalnya milik pt ka kemudian jv co dan akhirnya akan beralih menjadi milik asing adanya pengembangan tambang banko tengah blok timur dan pembangunan jalur kereta api serta pelabuhan railway port pemerintah kembali menempatkan pt ka pada posisi sulit karena ketika proyek ini selesai dan beroperasi patut diduga pt ba akan mengabaikan jv co an lebih mengembangkan proyek tersebut kalau ini terjadi maka jv co akan mati suri karena kalah bersaing kegiatan jv co hanya direncanakan untuk angkutan batubara saja tidak termasuk loading dan unloading batubara secara keseluruhan yang saat ini masih dibawah kendali pt ba gangguan dalam kecepatan dan ketepatan angkutan batubara sampai ke konsumen pltu suralaya dll sangat mungkin terjadi saat loading dan unloading batubara ke dan dari keretagerbong namun jika terjadi keterlambatan saat loading dan unloading pt ka yang akan menanggung rugi langkah apa yang harus diambil oleh pemerintahagar tidak terjadi jeruk makan jeruk sesama bumn sebaiknya kementerian negara bumn bersama departemen perhubungan disarankan dapat mengambil langkah langkah strategis seperti berikut ini hindari kepemilikan silang karena kepemilikan silang dapat menimbulkan conflict of interest bagi pt ba yang memiliki saham di dua perusahaan berbeda tetapi mempunyai bisnis yang sejenis kantor menneg bumn jangan memaksakan pembentukan jv co tetapi cukup joint operation jo saja untuk angkutan batubara di sumbagsel setelah divre iii dijadikan anak perusahaan terlebih dahulu kalaupun pembentukan jv co akan dipaksakan maka pt ba harus menyerahkan proses loading dan unloading ke dalam operasional jv co tidak hanya angkutan batubaranya saja pt ka divre iii harus diberdayakan melalui jaminan kontrak angkutan dari pt ba selama sekian tahun sehingga kontrak tersebut oleh pt ka dapat digunakan sebagai jaminan untuk mencari dana yang akan digunakan membangun prasarana dan sarana di divre iiipasca terbitnya surat menteri perhubungan no kh ka mphb tertanggal juni tentang pemberian konsesi penyelenggaraan prasarana kereta api di sumbagsel ke pt ka perjuangan pt ka sudah maju selangkah intinya berdayakan pt ka terlebih dahulu sebelum diminta terjun bebas untuk bersaing dengan operator kereta api asing jangan ada lagi dusta di antara kita agus pambagio pemerhati kebijakan publik dan perlindungan konsumen
471410	austria	wina lima hari berada di austria untuk meliput pernak pernik piala eropa telahmembuat saya merindukan suara azan dan salat berjamaah setelah bertanya kesana kemari akhirnya saya bisa mengetahui tempat untuk memenuhi hasrat saya itu adalah islamic center vienna yang memiliki masjid terbesar di austria letaknyatidak jauh dari tempat saya bermukim sementara di wina cukup dijangkau dengan menumpang satu kali trem dan satu kali u bahn subway begitu turun di stasiun nueu donau saya sudah bisa melihat kubah masjid yang berwarna kehijauan waktu di jam tangan saya sudah menunjukkan pukul waktu setempat dari jadwal salat yang saya sudah ketahui zuhur di wina pada tanggal juni jatuh tepat pada pukul wib setelah foto foto sebentar untuk keperluan dokumentasi saya lalu mengambilwudhu dan menuju bagian dalam masjid sama seperti masjid pada umumnya di indonesia di sana ada hamparan karpet merah untuk salat hijab pemisah untuk jamaah wanita di bagian belakang mihrab dan mimbar bagi khatib ruangan salatnya kira kira berukuran x meter masjid itu terbagi dalam lantai lantai basement lantai dasar dan lantai atas karena jumlah jamaah salat zuhurnya sedikit maka yang digunakan untuk salat hanya lantai dasar saja sedangkan untuk bangunan islamic center secara keseluruhan berdiri di atas tanah kurang lebih seluas hektar kumandang azan akhirnya dilantunkan oleh marwan yang sehari harinya bertugas sebagai imam di masjid islamic center gaungnya hanya terdengar di dalam masjid saja karena tidak menggunakan pengeras suara cukup banyak orang yang salat zuhur berjamaah di islamic center tersebut terdiri dari satu saf kurang lebih an orang yang kebanyakan keturunan arab jumlah jamaahnya tidak beda jauh saat saya salat jamaah di tanah air usai salat bangunan lantai itu kembali sepi di sini akan sangat ramai saat salat jumat tiap lantai penuh jumlah orangnya sekitar orang mereka datang dari dalam dan luar kota wina untuk salat di sini kata direktur islamic center fareed al khotani kepada islamic center di wina adalah satu satunya tempat yang memiliki masjid relatif besar fareed mengatakan di kota kota lain di austria juga ada islamic center hanya saja tidak sebesar di wina selain untuk kegiatan ibadah bangunan yang diresmikan tahun itu juga dipakai untuk kegiatan pendidikan setiap weekend ada semacam pengajian bagi anak anak ada juga forum forum untuk dialog serta les bahasa arab atau jerman semua itu gratis anda tidak harus membayarnya promosi pria asal arab saudi itu di dalam islamic center tersebut juga dijual buku buku keislaman apakah ituhadis tafsir maupun buku islam kontemporer harganya berkisar dari euro soal jumlah pemeluk agama islam fareed mengatakan komposisinya persen dari total penduduk austria yang sebanyak juta jumlanya ribu dan jumlahnya meningkat kali lipat dalam jangka waktu tahunjelasnya menurutnya kehidupan umat islam di austria mudah pemerintah setempatmemberikan kebebasan pada umat agama apapun untuk memasuki semua lini kehidupan di sana muslim ada yang menjadi politisi bekerja di media maupun di sekolah sekolah di parlemen ada muslim di sana terangnya di akhir perpisahan fareed menyampaikan pesannya pada saudaranya sesama muslim di indonesia ia menyampaikan harapan besarnya agar muslim indonesia dapat menjadi contoh atau model kehidupan islam yang penuh kedamaian bagi dunia internasional dia pun tak lupa menyampaikan keinginannya untuk bertandang ke indonesia saya tahu indonesia tapi belum pernah ke sana saya ingin ke sana jika saya ke indonesia hal pertama yang akan saya lakukan adalah melihat bagaimana muslim sebanyak itu hidup dan bekerja pungkasnya
471424	Lapsus	jakarta tiba tiba terdengar teriakan seorang napi yang meraung kesakitan nana si napi yang meraung tersebut sedang mendapatkan salam perkenalan dari kepala suku alias ks kepala suku adalah sebutan bagi pimpinan geng di lembaga pemasyarakatan lp namanya saja di penjara salam perkenalan tentunya bukan acara yang manis apalagi menyenangkan siapapun tahu kerasnya kehidupan di penjara maka acara yang disebut sebagai salam perkenalan itu pun penuh kekerasan pukulan tamparan dan tendangan menjadi menu wajib dalam acara tersebut tidak heran bibir nana pecah dan badannya memar dihajar sang ks sudah hari ini si nana mendapatkan salam perkenalan dari ks ia belum mampu memberikan voucher seharga rp ribu ke ks kata rizal napi dari geng korea kepada selain mendapat salam perkenalan setiap pagi nana juga mendapat tugas membersihkan area tempat tidur dan mencuci pakaian dari sang ks seperti lp lainnya napi di lp pemuda tangerang terkotak kotak dalam sejumlah geng ada geng aceh korea sebutan untuk geng yang berisi napi napi dari medan lalu geng plg singkatan dari palembang geng gas atau singkatan dari gabungan anak selatan geng arek geng ambon dan geng timor semua geng itu menghuni blok penampungan di blok f lp pemuda tangerang lama dalam sebuah ruangan yang berukuran kali meter sebanyak napi menghuni ruangan yang berkapasitas orang tersebut di dalam ruangan itu ada pembatas yang terdiri dari papan triplek kesembilan papan triplek itu digunakan sebagai batasan dari beberapa geng yang berdasarkan suku atau daerah di blok f ini ada peraturan secara tidak tertulis yang berlaku peraturan tidak tertulis ini adalah adanya pembagian kelas ada kelas yaitu kelas a b dan c untuk kelas a si napi tidur dengan menggunakan kasur dan dapat menonton tv kelas b hanya mendapatkan kasur sedangkan kelas c tidur dengan menggunakan tikar uang voucher seharga rp ribu yang wajib disetor nana merupakan biaya perkenalan di kelas a uang ini diklaim untuk membayar dana kebersihan uang gerendel uang makan selama minggu dan uang kasur jika tidak diberikan dalam batas waktu tertentu maka akan diusir ke kelas c yang terdiri dari korpe sebutan bagi napi yang tidak pernah dijenguk keluarganya dan anak hilang kata rizal ternyata peraturan yang tidak tertulis di lp pemuda tangerang juga berlaku di lp narkotik cipinang jakarta timur edison napi kasus narkotik yang tertangkap di depok juga mendapatkan perlakuan yang sama seperti nana menurut eko teman satu blok dengan edison di blok d hal seperti ini kerap terjadi dengan mendapatkan voucher otomatis bisa mendapatkan uang uang itu bisa digunakan untuk biaya hidup selama di dalam penjara menurut eko perputaran pulsa di dalam bui bisa tidak ternilai harganya kondisi penjualan voucher seperti itu menurut corporate comunications pt bakrie telecom tbk a norman iljas tidak merugikan provider selular di tempatnya namun menurut norman informasi seperti ini merupakan masukan negatif bagi perusahaannya dan akan segera ditindak lanjuti untuk mengantisipasinya kerugian secara signifikan untuk provider tempat kami tidak tapi ini masukan negatif bagi perusahaan untuk segera ditindaklanjuti imbuh pria dengan sisiran rambut belah pinggir ini kepada norman menambahkan mengenai kartu replacement yang didapat dari dalam bui lalu digunakan untuk nomor baru tidak benar dan banyak menuai komplain dari konsumen karena nomor yang tidak digunakan lagi akan diberi tenggang waktu selama bulan sebelum diputus setelah itu kemudian diberikan waktu selama bulan untuk masa pembekuan sedangkan humas dirjen pemasyarakatan m akbar hadiprabowo mengatakan pihaknya sudah mengetahui masalah pemerasan antarnapi dengan menggunakan modus voucher pulsa karena itu pihaknya memberikan solusi dengan mendirikan telepon koin di dalam lp atau rutan kami sudah dengar itu tetapi kami tidak bisa memantau detik demi detik kejadian yang berada di dalam karena keterbatasan karena itu untuk mencegahnya kami membangun telepon koin di area lp atau rutan kata akbar kepada akbar menambahkan bisnis kartu dan voucher di dalam penjara merupakan sesuatu yang wajar dan tidak menyalahi aturan hukum asal mendapatkannya dengan tidak melanggar hukum apabila ada yang melanggar dengan cara pemerasan atau semacamnya tertangkap tangan oleh petugas tetap akan mendapatkan sanksi hukum
