471611	Lapsus	jakarta satu persatu anggota dpr tersandung kasus suap di tahun enam politisi yang duduk maupun sempat duduk di dpr diseret kpk karena korupsi dan penyuapan tercatat nama saleh djasit al amin nasution hamka yamdu antony zeidra abidin sarjan taher dan teranyar bulyan royan tersandung kasus korupsi dan harus meringkuk di penjara terkuaknya kasus kasus yang melibatkan para politisi semakin memperkuat tudingan kalau gedung dpr selama ini menjadi ladang untuk korupsi jangan heran kalau barometer korupsi tahun yang dikeluarkan transparency internasional indonesia tii menempatkan dpr sebagai lembaga terkorup posisi dpr agak melorot satu tingkat ketika lembaga serupa kembali mengumumkan indeks barometer korupsi global peringkat korupsinya dikalahkan kepolisian yang duduk di peringkat pertama sedangkan dpr duduk bareng lembaga pengadilan di urutan kedua sebagai lembaga terkorup hasil ini tentu tidak mengenakkan bagi lembaga yang bertugas mengakomodir kepentingan rakyat sekalipun belum tentu semua anggota dpr melakukan korupsi tapi setidaknya kadung ada anggapan bila lembaga tersebut sudah tercemar kondisi ini diperparah dengan munculnya video mesum yahya zaeni dan maria eva serta kasus pelecehan seksual yang ditudingkan kepada anggota dpr dari pdip max moein kondisi ini membuat badan urusan rumah tangga burt dpr mengeluarkan sebuah ide untuk memoles muka dpr yang terlanjur bopeng dengan sebuah program pencitraan program ini rencananya akan ditangani oleh konsultan yang dinilai ahli dalam hal pencitraan untuk proyek permak wajah di penghujung masa jabatan para anggota dewan burt dikabarkan telah menyiapkan dana rp miliar rencana ini masih dalam proses kalau tidak ada halangan program ini akan berjalan awal kata sekertariat jenderal setjen dpr nining indra shaleh tapi soal dananya kata nining bukan rp miliar seperti yang ramai disebut berbagai kalangan di senayan sebab angkanya masih dalam penggodokan di burt namun berapapun biayanya anggota burt dari fraksi pan farhan hamid menolak program ini soalnya program ini terkesan dibuat buat dan bisa menjadi blunder bagi dpr bodoh sekali kalau kita harus membuang uang yang sangat besar hanya untuk pencitraan wajah dpr“ tegas farhan menurut farhan seharusnya pencitraan positif harus keluar dari personal anggota dewan sendiri bukan dibuat buat oleh konsultan pencitraan anggota dpr yang tertangkap kpk saat ini sudah berjumlah orang dan yang terlibat skandal ada orang namun dari total yang tertangkap hanya dari jumlah anggota dpr yang tidak terlibat kasus apapun anggota dpr adalah politisi dan selebritis yang saat ini memang sedang ditunggu dan disukai oleh media tapi bukan berarti sarang korupsi hanya ada di dpr sebaiknya saat ini seluruh rapat harus diketahui oleh publik agar tidak terjadi hal seperti ini terang farhan sumber di dpr mengatakan proyek pencitraan ini juga sampai ke telinga ketua dpr agung laksono kabarnya agung sempat memanggil setjen dpr nining indra shaleh dan pimpinan burt dalam pertemuan itu agung menyatakan tidak setuju dan meminta burt agar hati hati bermain proyek di lingkungan dpr mike masih bagus pun digantiproyek proyek yang dilakukan di lingkungan dpr selama ini memang menjadi sorotan publik pasalnya hampir seluruh proyek yang dilakukan menggambarkan ketidakpedulian dpr terhadap kondisi masyarakat sebut saja rencana pengadaan laptop dan perbaikan rumah dinas bukan itu saja beberapa proyek di lingkungan dpr juga dinilai banyak kalangan beraroma korupsi dengan menyalahi keppres no tentang pedoman pelaksanaan pengadaan barang dan jasa pemerintah menurut hasil audit bpk terhadap puluhan proyek setjen dpr ditemukan penyelewengan anggaran yang berpotensi merugikan negara hingga rp miliar dari hasil audit bpk yang dipublikasi januari disebutkan dugaan penyelewengan anggaran terjadi dalam proyek prasarana fisik dan sarana rumah jabatan serta griya sabha dpr ri tahun anggaran misalnya dari laporan keuangan semester ii tahun diketahui ada item proyek yang diindikasikan melanggar keppres tentang pedoman pelaksanaan pengadaan barang dan jasa pemerintah selain itu beberapa proyek lainnya diindikasikan mengalami penggelembungan anggaran di antara tujuh belas proyek yang diduga melanggar keppres ialah kelebihan pembayaran pekerjaan penggantian instalasi pipa air bersih dan hydrant pemasangan instalasi listrik tegangan menengahrendah serta penggantian kabel poer lift senilai rp juta dari analisis auditor bpk pekerjaan penggantian lift gedung menggunakan kabel tahan api yang diimpor dengan demikian dikhawatirkan mengalami kekurangan onderdil di lapangan yang akan membahayakan fungsi lift padahal lift itu digunakan anggota dewan proyek lainnya ialah utang hasil pelelangan barang inventaris rumah jabatan anggota dpr di kalibata yang belum tertagih sebesar rp juta temuan tersebut diindikasikan melanggar keppres sehingga mengakibatkan terjadinya potensi kerugian negara selain itu ada dugaan proyek fiktif pada tahun anggaran senilai rp juta proyek tersebut menyangkut pengadaan pesawat telepon yang tidak diketahui keberadaannya dari proyek tersebut kerugian uang negara diduga sekitar rp sementara berdasarkan kajian hasil pemeriksaan bpk semester i tahun juga menemukan tidak tertibnya penyetoran pendapatan sewa wisma penginapan dpr ri cikopo tahun sehingga berpotensi merugikan negara rp juta yang sempat menghebohkan adalah terdapat kemahalan harga pembangunan pagar depan gedung dprmpr ri sebesar rp juta temuan dugaan penyelewengan setjen dpr oleh bpk berlanjut pada hasil kajian bpk atas laporan keuangan semester i tahun anggaran di antaranya tidak tertibnya penyetoran pendapatan atas jasa giro rekening koran setjen dpr ri sebesar rp juta ditambah lagi adanya denda keterlambatan dalam pengadaan mesin fotokopi pembangunan ruang server dan pembangunan gedung griya sabha tahun anggaran sebesar rp juta pada januari giliran setjen dpr mengganti beberapa mike yang ada di sejumlah ruangan padahal mik tersebut masih bagus dan layak digunakan tindakan setjen tersebut kemudian menuai reaksi badan yang mengurusi urusan dpr tersebut dianggap punya andil cukup banyak dalam memperburuk citra anggota dpr adanya dugaan penyimpangan proyek di dpr sebenarnya cukup memeriksa setjen dpr jelas anggota kppu muhammad iqbal
638483	tambang emas sumut	medan pembakaran terhadap kantor dan rumah dinas camat muara batangtoru kabupaten tapanuli selatan sumatera utara sumut menyebabkan kerugian mencapai miliaran rupiah semua berkas penting dan sarana kerja hangus terbakar camat muara batangtoru hotma dalit harahap menyatakan saat ini pihaknya masih mendata kerugian akibat pembakaran itu belum ditentukan bagaimana teknis kerja yang akan dilakukan beberapa hari ke depan kasus ini sudah dilaporkan kepada bapak bupati tapanuli selatan semuanya masih didata sekarang besok rencana kita akan membersihkan kantor kata harahap kepada wartawan selasa di muara batangtoru sekitar kilometer dari medan ibukota sumut harahap mengaku belum memutuskan kantor sementara untuk para pegawai pihak kecamatan akan mengoptimalkan sarana yang tersedia saat ini fokus menyelamatkan apa yang tersisa jumlah kerugian belum diketahui persis begitupun kata harahap nilainya akan mencapai miliaran rupiah jika dihitung dengan berbagai berkas administrasi yang musnah ketika pembakaran terjadi selasa siang kata dia lagi seluruh pegawai sudah menyingkir sehingga kantor dan rumah dinas dalam keadaan kosong pegawai membawa serta kendaraan operasional itu makanya tidak ada kendaraan yang ikut dibakar massa sekarang ini situasi sudah aman sudah terkendali massa warga sudah tidak ada lagi kata harahap suasana di kecamatan itu dilaporkan masih mencekam polisi masih berjaga jaga di sekitar tempat yang biasanya menjadi pusat keramaian warga hari ini ribuan warga kecamatan muara batangtoru dan kecamatan batangtoru berunjuk rasa menolak kehadiran perusahaan tambang emas pt agincourt resources anak perusahaan g resources group ltd massa merusak polsek batangtoru merusak dan membakar sejumlah mobil dan kantor camat batangtoru
638506	eskalator kecelakaan	jakarta seorang anak kecil tersangkut kakinya di dalam eskalator pusat grosir metro tanah abang lantai blok b pertolongan yang diberikan tergolong lambat karena butuh waktu cukup lama untuk mengeluarkan kaki anak malang tersebut masih nyangkut sekitar setengah jam anaknya nangis tutur saksi mata eko wibowo di lokasi kejadian kepada wartawan selasa eko yang bekerja di sebuah toko pakaian itu menjelaskan peristiwa tersebut terjadi pada pukul wib ketika itu bocah perempuan yang masih belum diketahui usianya itu hendak turun dari lantai ke lantai anaknya kegencet eskalator kejepit tadi tapi aku nggak berani lihat ke situ ada darahnya kata eko anak itu kejepit di bagian tengah eskalator usaha sang ibu menarik anaknya tidak membuahkan hasil kaki sang anak tetap tidak bisa ditarik keluar kaki sang anak akhirnya bisa keluar setelah eskalator dibongkar petugas setelah itu dia langsung dilarikan ke rumah sakit terdekat untuk mendapat tindakan pertama kejadian ini menurut eko menarik banyak perhatian kala itu namun pantauan pukul wib situasi di lokasi kejadian sudah sepi bahkan toko tempat eko berkerja yang jaraknya hanya meter dari eskalator itu juga sudah dirapikan eskalator yang dibongkar tampak berantakan tidak sempat dirapihkan sudah tampak juga pita pengaman polisi mengelilingi lokasi kejadian perkara
638528	Jokowi Dahlan Iskan	jakarta gubernur dki jakarta joko widodo jokowi yang mengunjungi kampung kumuh seharian sempat terjebak macet di tebet jakarta selatan jokowi justru senang karena bisa mendapat inspirasi solusi kemacetan ya harus ngerasain dong biar dapat inspirasi buat solusi kemacetan kata jokowi sembari tertawa hal ini disampaikan jokowi saat ditanya wartawan tentang pengalaman terjebak macet di tebet siang tadi jokowi baru saja bertemu dengan menteri bumn dahlan iskan di kantor kementerian bumn jl medan merdeka selatan jakarta selasa keduanya memakai baju serupa kemeja putih dan sepatu kets beraktivitas sejak pagi jokowi mengaku masih segar dia bahkan masih akan melanjutkan kunjungannya ke sejumlah titik di jakarta nggak masih segar masih mau keliling lagi kata jokowi dengan bersemangat seperti diberitakan perjalanan jokowi ke beberapa pemukiman warga yang dimulai sejak pukul wib hari ini awalnya berjalan lancar namun usai berkunjung di kawasan bukit duri tebet jakarta selatan jokowi yang menggunakan mobil innova warna hitam b rfr terjebak macet saat melintas di jembatan layang tebet kemacetan sepanjang meter terjadi mulai jembatan layang tebet hingga smpn jakarta kemacetan yang terpusat di depan smpn jakarta dikarenakan banyaknya mobil dan sepeda motor yang parkir di pinggir jalan dan memakan jalur jalan untuk menembus macet diperlukan waktu hingga menit kecepatan kendaraan hanya berkisar kmjam
638536	krl kereta commuter line	jakarta hujan deras turun disertai angin kencang dan petir menyambar melanda bogor cuaca kurang bersahabat ini membuat pohon tumbang dan kabel listrik krl kesamber geledek perjalanan krl jakarta bogor pun terhambat kabelnya ada yang kena petir selain itu juga ada pohon tumbang sehingga perjalanan krl jakarta bogor cuma sampai depok kata kahumas daops i pt kai mateta rizalulhaq kepada selasa mateta mengatakan peristiwa itu terjadi pada pukul wib kabel yang terkena sambaran petir berada di km antara depok dan citayam sedangkan lokasi pohon tumbang ada di km jarak antara keduanya tidak terlalu jauh hanya terpisah sekitar meter katanya untuk masalah perbaikan mateta belum bisa memastikan lama waktunya kita masih bekerja untuk memperbaikinya katanya
644442	jokowi	jakarta hutan kota di pulomas jaktim nasibnya merana tak terurus dan malah jadi tempat penampungan sampah tapi syukurlah kondisi hutan kota di klender jauh berbeda hutan kota di klender ini lebih terawat kicauan burung juga masih terdengar pantauan senin ada jenis tanaman di hutan kota seluas meter itu mulai dari mahoni beringin trembesi hingga cempaka siang hari beristirahat di hutan kota di klender pun terasa nyaman bahkan beberapa orang tampak hanya beralaskan kardus terlelap tidur di bawah rindang pohon sesekali suara burung terdengar bersahut sahutan hutan kota ini memang terawat sama sekali tidak ada sampah plastik hutan itu lokasi hutan kota ini berada di sekitar perlintasan klender di dekat flyover di kawasan rawamangun lokasi hutan kota ini bersebelahan dengan taman kota taman itu pun juga tertata rapi ada seorang pengurus taman seluas hektar itu banyak orang yang memanfaatkan taman untuk beristirahat atau sekedar bercengkerama di taman itu ada juga wc yang lumayan bisa digunakan walau masih jauh seperti kebersihan di mal
638618	jokowi	jakarta sambutan masyarakat begitu meriah saat jokowi melakukan kunjungan kerja untuk pertama kalinya sebagai gubernur dki begitu juga saat jokowi menginjakkan kakinya di kota paris jokowi jokowi begitulah sambutan yang diterima jokowi dari warga kota paris mulai dari anak kecil sampai dewasa bapak bapak sampai ibu ibu semua tampak bersuka cita mereka seperti menyambut artis idola yang sangat mereka nanti nantikan masyarakat mengarak jokowi ke mana pun dia beringsut kota paris yang dikunjungi jokowi adalah sebuah perkampungan padat penduduk di jl baladewa kiri kelurahan tanah tinggi jakarta pusat mengenakan setelan kemeja putih dengan lengan panjang tergulung plus celana jeans dan bersepatu kets jokowi menelusuri gang gang sempit di sana tak hanya berteriak teriak antusias terselip pula warga yang membawa poster bergambar jokowi ada juga yang mengingatkan supaya jokowi tidak lupa akan janji janjinya nih rakyat pengen salaman pak jangan lupa sama janji janjinya pak insya allah nanti bapak kerjanya bener tutur para warga melontarkan harapannya ratusan orang berebut ingin bersalaman dengan jokowi petugas satpol pp harus bekerja ekstra keras membelah kerumunan warga di gang yang lebarnya tidak lebih dari meter itu supaya jokowi bisa lewat ya kita mau lihat perkampungan di sini bagaimana daerahnya drainasenya jalanannya kampungnya terang jokowi perihal tujuan kunjungannya sambutan meriah itu tidak hanya terjadi waktu ketibaan jokowi saja saat jokowi dan rombongan menelusuri gang kecil ratusan warga tetap setia membuntutinya dari belakang sambil sesekali meneriakkan namanya jokowi jokowi jokowi pekik mereka mengingatkan suasana saat jokowi berkampanye bulan bulan lalu kunjungan jokowi berakhir di rumah susun tanah tinggi alias rustanti di rumah susun sangat sederhana itu jokowi sempat mendengarkan keluhan soal suplai air yang tidak sampai ke penghuni lantai atas rusun jokowi juga beristirahat sejenak di warung milik rominah dan membeli mangga di situ
638619	hawk 200	pekanbaru pesawat hawk yang jatuh di kampar riau belum divekuasi bangkai pesawat tempur itu hanya ditutupi terpal akses ke lokasi dijaga ketat sekitar pukul wib selasa warga masih terus berdatangan ke lokasi jalan amal perumahan pandau kecamatan pasir putih kabupaten kampar riau sekitar km dari lanud tni au di pekanbaru namun upaya mereka melihat sisa sisa jatuhnya pesawat kandas sebab tni au telah menutup pesawat dengan terpal lokasi kejadian dipasangi police line warga tidak diizinkan melintas selain itu akses ke jalan amal ditutup sejumlah anggota paskhas tni au menjaga ketat area tersebut menurut pengakuan warga usai kejadian personel tni au sempat berlaku kasar dan meminta paksa ponsel dengan alasan kejadian itu tidak boleh diabadikan sekarang mau minta ke mana hp kami yang dirampas mereka kata warga setempat suhendro yang ditemui di lokasi pesawat jatuh meter dari rumah warga di sekitar lokasi kejadian merupakan jalan yang menghubungkan pekanbaru dan jalan lintas timur sumatera jalinsum karena banyaknya warga yang berkerumun jalan tersebut macet parah
474319	vietnam	ho chi minh perang mungkin menjadi berkah tersembunyi bagi vietnam setelah didera perang berkepanjangan selama hampir abad dan dasawarsa kini jejak imperialisme itu menjadi jualan vietnam untuk mengundang turis vietnam dijajah perancis sejak abad tahun hingga tahun tentara perancis dipimpin rigault de genoully atas perintah napoleon iii menyerang pelabuhan da nang penyerangan itu gagal kendati berhasil menghancurkan kota dari sana penyerangan berlanjut ke gia dinh alias kota saigon yang sekarang bernama ho chi minh dari sana perancis berhasil menguasai provinsi di daerah sungai mekong hingga akhirnya pada agustus revolusi dilancarkan ho chi minh bapak komunis vietnam yang dipanggil bac ho paman ho dan viet minh revolusi itu berhasil membuat raja vietnam terakhir bao dai melepas tahta perlawanan demi perlawanan dilancarkan hingga akhirnya perjanjian jenewa ditandatangani juli perancis sepakat hengkang dari vietnam penjajahan abad itu menyisakan bekas bangunan bergaya perancis tampak di beberapa titik kota ho chi minh misalnya di distrik di jalan hai ba trung berdiri katedral notre dame katedral seluas x meter persegi itu mempunyai menara lonceng kembar yang tingginya mencapai meter batu bata asal marseilles yang menyusun katedral sejak tahun masih menunjukkann warna aslinya merah di depannya patung perawan maria berdiri dengan anggun menjulang setinggi meter patung berbahan marmer italia itu berbobot ton di sisi baratnya terdapat kantor pos pusat dengan gaya perancis pula dibangun tahun bagian depannya berukir nama nama ilmuwan perancis seperti ampere voltage focault dan lainnya tak hanya gedung nama jalan di dekat notre dame pun ada yang berbau perancis ada jalan pasteur seperti di kota bandung dan jalan alexandre de rhodes tengok juga reunification hall di jalan nam ky khoi nghia berdiri di atas lahan seluas hektar bangunan yang didesain arsitek perancis yang juga merancang balai kota hongkong hermite semula adalah rumah gubernur jenderal perancis sayang bangunan itu dibom saat vietnam perang dengan amerika serikat as untuk membumihanguskan paham komunis pada namun tahun bangunan itu dipugar dengan arsitek vietnam ngo viet thu bangunan yang asli jauh lebih indah dibanding bangunan yang baru ujar pemandu native i ring partner gathering le chau saat rombongan berkunjung ke sana kamis bangunan itu saat perang vietnam as ditempati keluarga presiden vietnam rencana dan strategi perang pun dibahas di reunification hall ini semula bangunan ini diberi nama independence hall saat kota saigon atau ho chi minh bebas dari cengkeraman as april namun saat vietnam utara dan vietnam selatan bersatu pada tahun nama reunification hall disematkan perancis menjajah vietnam untuk diperas sumber daya alamnya as menjajah untuk tujuan politik agar paham komunis tidak menyebar as menyerang vietnam karena bisa mengincar china dan rusia di utara melalui laos dan kamboja ujar chau sejak pusat pemerintahan pindah ke hanoi utara vietnam bangunan ini digunakan untuk menginap para tamu negara
638719	pameran anjing	jakarta empat kakinya menjejak tanah dengan tegap dan mantap dengan pandangan mata tajam anjing yang berwarna coklat dengan semburat hitam di bagian wajah itu mengawasi arena indo defence expo di prj kemayoran jakarta pusat kalau anda berpikir anjing itu hanya menjaga keamanan pameran maka anda salah anjing berjenis malinois yang bernama jack itu juga sebagian dari alat tempurkeamanan yang ikut ambil bagian dari pameran tersebut sang pawang gede pun berkenan menunjukkan aksi anjing pelacak dan pemburu yang sudah terlatih itu mula mula jack didudukkan di kursi stand mabes polri kemudian gede duduk di halaman hall d yang berjarak kurang lebih meter dari jack gede didekati seorang teman bernama made dan mengajaknya bersalaman anjing tersebut terus memperhatikan majikan dan kawannya itu ketika made hendak memukul gede dari belakang jack yang berasal dari jerman itu langsung berlari menggigit made menurut gede jack yang telah berumur tahun ini telah kali berhasil membantu polisi dalam menangani kasus empat di antaranya merupakan kasus pendeteksian kriminal di jabodetabek dan satu lagi kasus pencarian orang hilang di sulawesi utara papar gede gede menjadi pawang anjing semenjak bergabung di mabes polri tahun yang lalu sedangkan made satu tahun lebih lama dari gede menurut made menjadi pawang anjing sebenarnya bukanlah pilihannya namun lama kelamaan ia menikmati dunia ini jika ditekuni pekerjaan ini sangat menyenangkan akan ada banyak jalan dari sini ungkapnya kamis made mengaku telah beberapa kali ke luar negeri untuk mengikuti pendidikan melatih anjing pelacak menurutnya anjing adalah binatang yang cukup cerdas untuk latihan dasar seperti personal protection hanya membutuhkan waktu bulan jika anjing melakukan kesalahan kita kasih tahu yang benar bagaimana setelah atau kali diberi tahu dia akan mengerti tambahnya
