474968	ramadan	jakarta waktu baru saja menunjukkan pukul wib saat saiful baru sajamenjajakan dagangannya tempatnya berjualan hanya berupa lapak berukuran x meter yang terletak di pinggir jalan tanah abang jakarta pusat meski berukuran mini namun hasil penjualan di tempat inilah yang selama ini menghidupi ipul begitu bujang kelahiran jakarta ini biasa dipanggil sudah lima bulan belakangan ini ipul mengadu nasib di pasar tanah abang mengaku ingin memanfaatkan waktu menjelang bulan suci ramadan ipul pun berjualan kurma tak berapa lama ipul kedatangan pembeli percakapan khas antara penjual danpembeli itu pun terjadi berapa harga sekilo nya bang tanya seorang ibu sambil menunjuk salah satu keranjang kurma yang berjejer rapi di depannya yang itu harganya rp jawab ipul kepada si pembeli yang disapanya bu haji kurma yang dimaksud pada percakapan tadi ternyata adalah kurma madinah yangmemiliki tekstur lebih kering dan memiliki rasa manis yang khas ya pasar tanah abang memang sejak dahulu terkenal sebagai tempat grosir kurma berbagai jenis kurma banyak dijajakan di pasar ini mulai dari kurma mesir kurma madinah maupun kurma tunisia kebanyakan kurma memang berasal dari daerah timur tengah ataupun afrika namun ada juga kurma yang berasal dari california amerika yang biasa disebut orang kurma medjoo nama medjoo sendiri diambil dari nama asal pabrikan di amerika yang memproduksi kurma tersebut nama tersebut kemudian menjadi identik dengankurma asal negeri paman sam tersebut karena kata medjoo dituliskan di bagiandepan bungkusnya kini baik para penjual maupun para pembeli lebih sering menyebut kata medjoo untuk kurma amerika ini kurma medjoo juga dikenal sebagai kurma jumbo karena bentuknya yang lebih besar dibanding kurma lainnya untuk rasa kurma jumbo medjoo memiliki rasa yang mirip dengan kurma mesir yang manis selain asal negerinya yang beragam kurma juga memiliki harga yang bervariasi kurma mesir misalnya harga per kilonya berkisar antara rp rp harga yang sama juga di bandrol pada kurma madinah dan kurma lulu kurma lulu yang dimaksud adalah kurma yang diimpor dari dubai belum jelas benar kenapa diberi nama lulu yang pasti kurma ini memiliki rasa manis diselingi sedikit rasa masam sedangkan yang paling murah adalah kurma shahani yang per kilonya hanya seharga rp pilihan rasanya pun juga beragam untuk kurma madinah masih ada jenis lainnya yakni kurma madinah madu ditambahkan kata madu karena kurma madinah yang satu ini memang memiliki tekstur yang lebih lembut dan rasa yang lebih manis dengan ukuran yang sama dengan kurma madinah yang biasa karena keunggulannya itu maka kurma madina madu dibandrol lebih mahal per kilonya rp ada juga kurma tunisia kurma yang satu ini biasanya di jual dalam kemasan khusus dari pabriknya hal lain yang berbeda dari kurma tunisia adalah kurma ini biasanya masih menempel pada rantingnya dan setiap potongan ranting terdiri dari buah kurma kurma tunisia bisa dibilang memiliki rasa lebih istimewa dibanding jenis kurma lainnya bentuknya sedikit memanjang dan lebih kering pada bagian kulitnya rasa manisnya pun bisa dibilang lebih sederhana sehingga sangat ringan untuk dijadikan teman minum teh atau cemilan di kala senggang untuk kurma tunisia eceran pembeli bisa membawa pulang dengan membayar rp untuk sekilonya sedangkan kurma yang sudah di kemas harganya lebih mahal rp khusus di bulan ramadan ini banyak penjual kurma di kawasan tanah abang justru kebanjiran rejeki sehingga banyak penjual kurma musiman di wilayah ini seperti halnya ipul bahkan ada juga beberapa pedagang yang bahkan pekerjaan sehari harinya sebagai kuli bangunan yang lalu banting setir sebagai pedagang kurma di sepanjang bulan ramadhan ini alex salah satunya alex mengaku memanfaatkan momen ramadhan ini karena tergoda dengan keuntungan yang didapat saya mulai berjualan sejak dua minggu menjelang ramadhan dan sejak saat itu saya mendapatkan untung yang lumayan kata alex sambil mengelap keringat alex dan rekan rekannya memanfaatkan arena bazar yang buka selama ramadan di kawasan tanah abang sebagai tempat mengais rejeki momen ramadan adalah dirasa waktu yang tepat bagi mereka untuk berdagang kurma masyarakat sejak sebulan menjelang puasa memang sudah banyak yang mencari cari kurma ini memang buah yang jadi ciri khas di bulan ramadan aku alex sambil sesekali diamini oleh rekan rekan sesama penjual baik ipul maupuan alex sama sama mengaku baru mendapatkan untung terbesar selama berjualan adalah pada saat satu minggu menjelang puasa bahkan saat satu hari menjelang puasa omset saya sampai mencapai rp juta ujar alex sumringah hal ini menurut alex maupun ipul dan penjual kurma lainnya adalah sebuah berkah di bulan suci ramadan karena memang jarang terjadi di hari hari biasa pedagang hanya mengaku meraup laba rata rata rp juta an sedangkan selama bulan ramadan kebanyakan mereka mengaku penghasilannya bertambah lima kali lipat selain berjualan kurma para penjual juga menambahkan beberapa penganan lainyang biasa dijumpai orang yang baru pulang berhaji aneka kismis kacang arab dan kacang pistacio adalah teman yang biasa mengiringi kurma karena harga kismis yang lebih mahal per kilo nya rp orang orang biasanya membeli paket hemat dengan mencampurkan kurma dengan kismis dan kacang kacangan lumayan dengan harga sekilo kurma mesir saya bisa merasakan tiga jenispenganan sekaligus ya kismis kacang dan kurma itu sendiri ucap erni pembeli yang sejak tadi di panggil bu haji oleh para penjual lantaran erni mengenakan busana muslim sebelum berbalik arah pulang erni pun masih penasaran dengan kurma yang dipajang di bagian paling atas gerai milik ipul ia pun lalu menanyakan kepada si penjual untuk mengetahui kurma jenis apa yang di balut kemasan rapih itu sang penjual lalu mengatakan bahwa itu adalah kurma nabi atau khas disebut kurma ajwa harganya rp ribu saja tidak dimahalin kok tambah ipul erni yang sedikit terperangah dengan harga kurma kemasan itu lalu menanyakanasal usul kurma yang disebut kurma nabi itu menurut riwayat kurma ajwa adalah kurma yang diyakini sama dengan jenis kurma yang ditanam oleh nabi muhammad saw pada saat menjelang ramadan sehingga kurma ini pun menjadi spesial setelah mendengarkan penjelasan tersebut erni pun lalu melangkah pergi mahal pungkasnya
638733	TNI alutsista	jakarta divisi penelitian dan pengembangan angkatan udara dislitbang au pamerkan berbagai macam produk hasil penelitiannya di indo defence expo and forum salah satu produk andalannya adalah smart bomb seperti namanya smart bomb merupakan bom pintar karena telah dilengkapi peralatan sensor elektronik berupa guidance kit guidance kit yang terletak di bagian ujung belakang bom ini dilengkapi gps yang siap dioperasikan oleh pilot menurut petugas jaga stand dislitbang au mashuri sirip bom yang berwarna orange ini dapat berubah posisi sesuai dengan kebutuhan dan kemampuan baterai pilot akan mengendalikan dengan langsung menentukan berapa koordinat sasaran sehingga tingkat akurasi jatuhnya bom lebih tepat terangnya dalam pameran yang digelar di jie kemayoran jakarta pusat kamis bom yang memiliki panjang lebih dari meter ini adalah buatan jerman dan telah digunakan pada pesawat nato dan hawk namun sayangnya belum pernah dilakukan uji coba di indonesia kami baru melakukan penelitian memang tahun ini sasarannya prototype dulu ucap mashuri walau mengusung kata smart yang berarti pintar produk ini juga masih memiliki keterbatasan yakni belum mampu digunakan untuk sasaran yang bergerak sebab kendalinya disetting sebelum bom diluncurkan sehingga ketika koordinat sasaran berubah bom ini belum mampu mendeteksi pergerakannya menurut mashuri smart bomb akan diuji coba tahun depan selanjutnya akan dibuka tender untuk produksi bom baru ini
556468	merapi	magelang sungguh manusia tidak bisa melawan hukum alam selama puluhan tahun aliran kali putih diubah atas nama pembangunan daerah namun merapi punya aturan sendiri pasca lahar dingin kali putih kembali ke bentuk aslinya pada bagi warga di sekitar kali putih magelang jawa tengah inilah jawaban atas doa mereka selama ini menurut mereka bentuk kali putih yang paling aman terhadap bahaya merapi adalah kali putih pada zaman awal kemerdekaan di tahun dahulu pada tahun terdapat dua alur sungai yaitu kali putih dan kali druju yang melintasi jalan raya magelang yogyakarta di km saat itu alur itu diperkuat dengan dam buatan kolonial belanda namun pada masa orde baru kali putih sengaja diubah kali putih dan kali druju disatukan alirannya rupanya ada kepentingan ekonomi menyusul berdirinya pasar tradisional jumoyo keberadaan kali druju di sisi barat jalan raya magelang yang melintasi dusun prebutan dusun gatakan dan dusun ngresap di desa gulon kecamatan salam seolah olah dikesampingkan dam kali putih pun saat itu langsung disulap pemerintah menjadi sebuah areal persawahan dengan panjang alur sungai kilometer sawah mendadak itu tiba tiba menjadi hak milik warga yang tidak jelas keberadaanya dan kedatangannya masyarakat sebetulnya merasa lebih aman jika dam kali putih dipelihara semasa zaman belanda jika terjadi erupsi merapi material seperti lahar dingin dulu tidak sampai meluap seperti sekarang ini batu batu besar yang menggelinding di aliran sungai tidak pernah sampai menghantam dan menerjang rumah kisah jratun salah seorang sesepuh dusun kemburan desa jumoyo kecamatan salam magelang selasa kala itu warga dengan nikmatnya bisa menonton material baik erupsi merapi maupun banjir lahar dingin dengan indahnya menggelinding di alur kali putih saat itu saya bisa melihat batu batu besar mengeluarkan asap menggelinding di dalam sungai tanpa rasa kawatir dan was was sekarang saya tidak berani tegas jratun jratun menuturkan pasca erupsi merapi tahun inisiatif pemerintah untuk menyatukan kali putih dan kali druju sempat mendapat protes namun protes tentu tidak diperhatikan oleh pemerintah orde baru bangunan bersejarah berupa dam kali putih pun hilang malah muncul alur sungai baru di sepanjang jalan raya magelang yogyakarta km yang tepat berada di belakang pemukiman dan pertokoan yang berjejer di pinggir jalan besar akibatnya saat ini jembatan kali putih yang sebenarnya dulu kali druju tidak muat jika terjadi erupsi merapi dan banjir lahar dingin tegas jratun yang lahir tahun itu bila terjadi erupsi merapi dan banjir lahar dingin setiap lima tahun sekali warga pasti merasa was was dan khawatir jika terjadi luapan material ke jalan raya magelang yogyakarta tokoh agama dusun gempol kh mahyat juga menilai bencana lahar dingin adalah peringatan tuhan agar manusia tidak mengejar kepentingan materi dengan mengabaikan aturan alam pemerintah harus peka dan melihat sejarah bila memang ingin memindah sungai tidak hanya serta merta memindah tanpa melihat ekses dan akibat yang merugikan serta membuat banyak warga sedih serta trauma akibat tertimpa bencana tegas mahyat kepala desa jumoyo sungkono saat ditemui di pengungsian di lapangan jumoyo mengatakan warga sudah lelah menuntut agar kali putih dikembalikan seperti semula pemerintah dan wakil rakyat tidak bergeming kalau sudah seperti ini ribuan warga tertimpa bencana anak anak orang tua orang tua menderita di pengungsian apa yang bisa kami lakukan kata sungkono dia berharap bencana ini bisa menjadi pelajaran pemerintah inilah pentingnya mendengarkan aspirasi rakyat kecil masyarakat bawah yang merasakan langsung dampak pemindahan alur sungai kali putih yang dijadikan satu dengan kali druju tegas sungkono dengan mata berkaca kaca
638813	jakarta	jakarta tiga orang pekerja bangunan ini terlihat sibuk mengecat sebuah mal di cibubur hanya dengan peralatan keamanan seadanya mereka bergelayutan di tali sambil berpegangan pada batang bambu penopang sederhana jefry aris dan omen nama ketiga pekerja bangunan itu mereka semua berasal dari tasikmalaya jawa barat sengaja merantau ke jakarta untuk mencari nafkah saat ditemui selasa mereka sedang istirahat dari pekerjaan tugas ketiganya adalah mengecat bangunan mal setinggi puluhan meter itu hingga kembali mengkilat peralatan mereka sederhana cukup dengan kuas dan cat lalu tali yang diikat di tubuh tak lupa sejumlah batang bambu yang disusun sebagai pijakan sebuah jaring besar dipasang di bawah bambu tak ada helm pengaman atau peralatan penunjang keselamatan lainnya sesekali para pekerja itu juga mengangkut bambu untuk disusun sebagian lagi ada yang mengecat dan membersihkan dinding antara takut nggak takut kerja begini tapi udah biasa juga kerja kayak gini udah kerja kaya spiderman bajakan kata aris menurut aris sebetulnya ada tujuh orang pekerja dalam proyek ini guna mengecat seluruh bangunan diperkirakan butuh waktu tiga bulan sekarang baru masuk bulan pertama terangnya sambil ngos ngosan para pekerja dibayar rp ribu per hari mereka ke jakarta mengaku diajak oleh orang tua sejak beberapa bulan lalu saat ditanya soal keselamatan para pekerja mengaku khawatir dengan risiko itu tapi kebutuhan akan upah lebih penting bagi mereka tadi kerja pake tali pengaman di pinggang cuma nggak dikaitin biar nggak ribet ucap jefry enteng bila hujan pekerjaan mereka pun dihentikan termasuk bila angin kencang melanda namanya juga kerja ya pasti ada risiko kita jalani saja tambah jefry
475846	bawaslu	jakarta memulai sesuatu yang baru tentulah tidak selalu mudah tetapi memperjuangkansesuatu yang sulit pastilah juga bukan tanpa makna setelah sekian lamamenumpang di gedung joeang badan pengawas pemilu bawaslu akhirnyamenempati kantor baru “untuk mendapatkan kantor baru ini butuh perjuangan yang berat disini jauhlebih nyaman kami merasa inilah suasana kantor yang sesungguhnya” ujar kepala humas bawaslu osbin samosir kepada yang ditemui dikantornya jl mh thamrin jakarta pusat jumat kantor baru yang terletak persis berhadap hadapan dengan gedung pusat perbelanjaan dan perkantoran sarinah ini dulunya gedung pbb namun sejak januari gedung ini resmi menjadi kantor tetap bawaslu pada juli bawaslu mengirimkan surat bernomor lbawasluviikepada menteri sekretaris negara dengan tembusan menteri dalam negeri menteri negara pendayagunaan aparatur negara dan ketua kpu surat ini berkaitan dengan permohonan penggunaan gedung untuk bawaslu “kita baru sungguh sunguh mendapat izin itu pada akhir oktober kemudian baru bisa menempati gedung baru ini pada desember ” jelasnya dengan perpaduan warna abu abu dan coklat kayu gedung yang memiliki lantai ini hanya lantai yang dijadikan kantor bawaslu yaitu pada lantai dan pada lantai digunakan untuk ruang penerima tamu dan disisi lainnya akandibangun ruang untuk media center seluas x meter persegi dengan komposisi ruangan dibagi tiga yaitu ruang untuk rapat atau seminar ruang operator media center dan yang terakhir adalah ruang wartawan sementara di lantai yang memilki luas meter persegi ini menjadi ruang kerja utama bagi karyawan bawaslu saat ini renovasi gedung sudah persen selesai pekerjaan yang memakan waktu bulan ini menghabiskan biaya sekitar miliar sejak resmi dilantik dan diambil sumpahnya pada tanggal april badanpengawas pemilu bawaslu sebagai sebuah lembaga negara belum memiliki sebuah sarana prasarana memadai yang dapat menunjang kinerjanya pria berkaca mata itu menuturkan kisah dukanya saat masih berkantor di gedung joeang yang terletak di jl menteng raya no di gedung bersejarah yang sudah tua dan sempit itulah badan pengawas pemilu bawaslu menyewa salah satu ruangan untuk menjadi kantornya kepada bawaslu ruangan yang bisa disewakan pun sangat terbatas yakni hanya meter persegi “kisah di gedung joeang itu sangat memilukan kita bayar kontrak terus tapi seolah olah kita disuruh pindah pihak pengelola selalu bertanya kapan bawaslu pindah “ kenang osbin dengan suara rendah dalam struktur bawaslu terdapat empat bagian bidang umum dan keuangan perencanaan dan data pengawasan dan hukum terakhir bidang humas danpartisipasi masyarakat keempat bidang tersebut saat ini telah memiliki ruang masing masing untuk kenyamanan mereka dalam bekerja “tidak seperti di gedung joeang kantor kita kaya pasar semua bidangdigabungkan menjadi satu ruangan termasuk kepala sekretariat” imbuh priaberdarah batak ini
638953	kalimantan semburan lumpur	jakarta polres kutai timur membuat garis batas dilarang melintas dengan radius meter dari titik semburan lumpur di kawasan pipe yard logistik pertamina sangatta kabupaten kutai timur kalimantan timur hal ini agar masyarakat tidak mendekati lokasi semburan lumpur tersebut pengamanan kita di lokasi sudah kita bikin garis batas larangan melintas dengan radius hingga meter dari titik semburan lumpur kata kapolres kutai timur akbp budi santosa kepada melalui telepon rabu malam budi menjelaskan hasil koordinasi yang dilakukannya bersama dengan pt pertamina ep region kti sangatta field menunjukkan bahwa daerah titik semburan lumpur bukan termasuk area pengeboran sehingga semburan yang muncul tidak membahayakan dari hasil koordinasi kita dengan pertamina titik semburan bukan daerah pengeboran yang keluar bukan minyak bukan juga gas murni tapi memang lumpur bercampur air ujar budi dugaan sementara semburan lumpur keluar karena faktor alam bukan seperti semburan lumpur yang ada di sidoarjo prediksi pertamina dalam hari akan tuntas ditanganinya menghentikan semburan lumpur tambahnya masih menurut budi ketinggian semburan lumpur mencapai hingga sekitar centimeter di lokasi sambungnya ditutup dengan seng baja untuk menghindari kemungkinan masyarakat nekat mendekati lokasi titik semburan tersebut ditutup dengan seng untuk keamanan dengan penjagaan petugas sekuriti pertamina dan dari satuan obyek vital polres kutai timur semburan itu tidak mengandung gas berbahaya tegasnya kita juga sudah meminta kepada perangkat desa untuk memberitahukan kepada masyarakat setempat meski jauh dari pemukiman untuk tidak khawatir terang budi alat berat berikut truk sudah berada di lokasi yang digunakan untuk menggali lubang dan mengangkut lumpur yang keluar ke permukaan truk untuk mengangkut lumpur alat beratnya untuk membuat lubang untuk mengalihkan atau menampung keluarnya lumpur ungkap budi meski demikian beredar kabar bahwa semburan lumpur mengandung gas metan dengan prosentase persen dikonfirmasi hal itu budi membantahnya dia memastikan semburan lumpur tidak mengandung gas dari data pertamina yang kita dapatkan lumpur yang keluar dan diangkut dengan menggunakan truk tangki sebanyak ton tanpa cairan minyak mentah kondisi di sekitar semburan cukup aman tutupnya seperti diketahui semburan lumpur bercampur pasir mencuat ke permukaan sejak selasa pagi sekitar pukul wita ketinggian semburan kurang dari meter petugas layanan operasi pt pertamina ep region kti sangatta field enriko hutasoit ketika dikonfirmasi membenarkan insiden semburan lumpur tersebut
638982	tol	jakarta proses pengerjaan ruas tol jorr w kebon jeruk ulujami terus berjalan sekretaris tim pembebasan tanah jorr w ditjen bina marga kementerian pu sain mengatakan sebanyak warga hari ini mendapatkan uang ganti rugi atas lahannya yang tergerus karena pembangunan tol tersebut dana yang dikucurkan untuk ganti rugi totalnya mencapai rp miliar ada warga jadi bidang di meruya utara total dananya rp dengan total lahannya meter persegi ungkap sain saat ditemui wartawan di kantor walikota jakarta barat senin rata rata ganti ruginya rp jutameter persegi imbuhnya dia menambahkan sebenarnya ada bidang lahan yang belum terbebaskan namun karena masalah kelengkapan surat dan sertifikat bidang tanah sisanya belum dapat dibayarkan ganti ruginya sebetulnya adalah bidang setelah pemerikasaan menjadi bidang jadi bidang masih ada permasalahan surat surat lanjutnya mekanisme pembayarannya lanjut sain warga mendapatkan fasilitas untuk membuka rekening di bank hingga kemudian uang ganti rugi itu dibayarkan melalui bank tersebut warga kita undang kita kerjasama dengan bank mandiri jadi nanti warga itu membuka rekening dulu di bank mandiri tambahnya seperti diketahui jalan tol jorr w ini memiliki panjang jalan km pt marga lintas jakarta adalah anak usaha dari pt jasa marga selaku pemegang konsesi atas ruas tol ini total investasi untuk ruas tol ini diperkirakan menelan dana rp triliun
638997	gempa myanmar	yangon korban jiwa akibat gempa bumi di myanmar terus bertambah sejauh ini sudah orang yang tewas akibat gempa berkekuatan skala richter sr tersebut puluhan orang lainnya luka luka dalam bencana alam itu menurut badan survei geologi as usgs gempa tersebut terjadi pada minggu sekitar pukul waktu setempat dengan kedalaman hanya sekitar kilometer pusat gempa berada sekitar kilometer sebelah utara kota mandalay kota terbesar kedua di myanmar para korban jiwa termasuk empat orang yang tewas ketika jembatan yang masih dalam proses pembangunan ambruk di atas sungai irrawaddy di sebelah timur kota shwebo dua orang tewas ketika sebuah biara roboh di dekat desa kyauk myaung kemudian enam orang lainnya tewas di kota sint ku saya tak pernah merasakan gempa sekuat ini saya juga mendengar suara suara bergemuruh dan lampu mati kata seorang warga setempat seperti dilansir news com au senin usgs menyatakan gempa susulan berkekuatan sr mengguncang wilayah yang sama pada minggu malam namun tak ada laporan korban jiwa maupun kerusakan baru akibat gempa susulan ini menurut usgs gempa berkekuatan sr juga melanda pada senin dini hari waktu setempat pusat gempa berada pada kedalaman sekitar kilometer pada maret sekitar orang tewas dan puluhan lainnya luka luka ketika gempa sr mengguncang wilayah myanmar dekat perbatasan dengan thailand dan laos
639007	iran pesawat	teheran di tengah ancaman perang israel iran menggelar latihan pertahanan udara hari ini latihan ini dimaksudkan untuk mengoptimalkan kemampuan perlawanan iran serta mengirimkan peringatan kuat bagi mereka yang mengancam akan melancarkan serangan militer latihan ini semula dijadwalkan berlangsung pada awal oktober lalu namun kemudian ditunda tanpa ada penjelasan resmi menurut media iran seperti dilansir kantor berita afp senin sekitar ribu tentara dari berbagai unit ikut serta dalam latihan yang akan berlangsung selama empat hari ini latihan ini mencakup daerah seluas ribu kilometer persegi di wilayah wiayah timur iran berbagai sistem rudal dan artileri juga jet jet tempur dan pesawat pengebom akan digunakan dalam latihan kali ini militer iran kerap menggelar uji coba rudal dan manuver manuver untuk menunjukkan kekuatan militernya dalam menghadapi ancaman pihak pihak luar latihan latihan tersebut telah meningkat frekuensinya dalam beberapa tahun terakhir khususnya di tengah meningkatnya ketegangan dengan barat dan adanya ancaman serangan udara israel atas fasilitas nuklir iran bagi mereka yang berpikir tentang agresi terhadap republik islam iran latihan ini harus dipandang sebagai peringatan keras tegas juru bicara latihan militer ini brigadir jenderal shahrokh shahram kepada press tv latihan ini diadakan hanya beberapa hari setelah insiden pesawat tak berawak as diserang oleh dua jet tempur iran di kawasan teluk dalam insiden yang terjadi november itu iran mengklaim pesawat tanpa awak milik as itu telah menyusup masuk ke wilayah udaranya namun pentagon bersikeras bahwa pesawat tersebut berada di wilayah internasional dan sedang melakukan misi pengintaian rutin
477392	jerman	belin malam pergantian tahun menuju dirayakan begitu meriah di berbagai belahan dunia tidak terkecuali di berlin jerman pesta tahun baru besar besaran digelar dan diklaim yang terbesar di eropa seperti layaknya kota kota besar dunia lainnya pusat perayaan tahun baru digelar di monumen atau gedung landmark kota di berlin kamis perayaan itu dilakukan di depan monumen brandenburger tor yang menjadi simbol terpisahnya jerman barat dan timur perayaan tahun baru ini memakan area seluas ribu meter persegi dari monumen brandenburger tor memanjang sampai taman kota tiergarten yang luas sekitar juta warga berlin dan kota lain tumpah ruah di sini pantauan masyarakat berduyun duyun datang dari segala penjuru area acara sudah disterilkan dari kendaraan sejak sore hari monumen brandenburger tor dan taman tiergarten sudah dipasangi pagar kawat mereka yang ingin merayakan tahun baru harus masuk dari arah tiergarten suasana di sekitarnya penuh dengan orang orang yang bermain petasan dan kembang api sambil menunggu puncak acara bau mercon yang pekat bercampur dengan bau bir dari botol botol yang berpecahan di jalanan suhu minus derajat celcius tidak menghalangi pengunjung untuk datang di depan monumen dipasang panggung hiburan musik dan layar raksasa lampu sorot dan permainan laser suara hinggar bingar terdengar memekakan telinga para artis dan band ternama jerman bergantian menyanyi menghibur pengunjung pengamanan polisi pun luar biasa ketatnya selain mobil dan helikopter yang berpatroli ratusan aparat pun berjaga di setiap sudut sejumlah orang beradu mulut dengan polisi karena memaksa masuk dari samping monumen yang sudah dipasangi pagar kawat di pintu masuk resmi di tiergarten pun pengamanan tidak kalah ketatnya semua pengunjung digeledah sebelum memasuki area perayaan tahun baru semua tas harus dibuka sambil disorot senter kein bier kein bier tidak boleh ada bir red tegas para polisi ini berulang ulang mereka yang terlanjur membawa botol botol bir tampak kecewa hanya minuman ringan dan air mineral yang boleh dibawa ke dalam area bujuk rayu pun percuma selain bir petasan dan kembang api juga tidak boleh dibawa pengunjung pun memilih menghabiskan bir mereka dan bermain petasan sampai habis sebelum masuk ke dalam saat yang ditunggu tunggu pun tiba ramai ramai menghitung mundur para artis dan dj memberi komando dari panggung musik tepat pukul waktu setempat pesta kembang api pun dimulai sorak sorai membahana beraneka jenis kembang api menghiasi langit dengan semarak menyambut datangnya tahun bedanya dengan perayaan tahun baru di indonesia di jerman tidak ada kebiasaan konvoi motor atau mobil keliling kota bubar acara para pengunjung pun pulang berjalan kaki menuju stasiun kereta atau subway dan halte bus terdekat sebagian pulang ke rumah atau melanjutkan pesta di tempat lain
