480854	opini	jakarta pada pemilu total biaya iklan politik mencapai rp miliar nielsen media indonesia mencatat biaya iklan pemerintahan dan politik tahun telah mencapai rp triliun atau naik persen dibandingkan dengan tahun yang hanya rp triliun rizal subiakto ceo hotline advertising mengakui bahwa ketika menangani kampanye sby jk pada pemilu dia menghabiskan dana sekitar rp miliar sementara kampanye pasangan cagub dki fauzi bowo menghabiskan dana sekitar rp miliar subiakto juga menjelaskan bahwa belanja iklan indonesia tahun adalah sekitar triliun rupiah dan sekitar triliun persen adalah belanja iklan politik tahun dan iklan politik ini akan meningkat sampai kali lipat lebih besar dari tahun sementara irfan wachid dari frame indonesia production mengatakan seorang politikus nasional akan menghabiskan rp miliarbulan untuk biaya poles diri poles senyum di hadapan rakyat pemilihnya majalah fortune memperkirakan total dana kampanye untuk pemilu di amerika mencapai usd miliar oleh karenanya agak tepat apa yang dikatakan seorang konsultan politik indonesia rizal malarangeng di jawa pos “demokrasi memang mahal bung” iklan memang mahal dalam kondisi ekonomi rakyat yang masih terpuruk seperti sekarang tidak etis jika menghamburkan uang hanya untuk beriklan masyarakat akan lebih mengingat tindakan langsung seperti kerja kerja sosial yang mereka terima hal senada diungkapkan pengamat politik cides indria samego yang menilai iklan politik sebagai hal yang tidak etis di tengah ancaman meluasnya dampak krisis finansial global semakin dekat saat pemilu semakin banyak partai politik parpol dan juga capres menggelontorkan dana mereka untuk membuat iklan politik maraknya penayangan iklan politik dinilai oleh sejumlah pengamat sebagai bentuk manipulasi politik yang tidak mendidik masyarakat pengamat politik asal universitas gadjah mada purwo santoso mengatakan secara struktural iklan merupakan konsekuensi atau kebutuhan dari parpol tetapi biayanya tidak harus dalam bentuk gelontoran uang miliaran rupiah tapi cukup dengan kerja kerja konkret membantu masyarakat sebagai calon konstituen mereka dia menambahkan jika memang parpol telah maksimal melaksanakan kerja kerja sosial itu seharusnya mereka tidak perlu khawatir kehilangan simpati masyarakat dan tidak lagi membuat iklan yang banyak menelan biaya sampai saat ini belanja iklan politik parpol dan pemerintah untuk pemilu hingga saat ini sudah mencapai rp miliar jumlah itu diperkirakan bakal bertambah seiring semakin dekatnya waktu pemilu wakil direktur eksekutif lembaga pemenangan pemilu partai golkar jeffrie geovanie menyebutkan akan terus menambah frekuensi iklan hingga pelaksanaan pemilu jika modal iklan kami persen sebanyak persen dipakai pada bulan januari persen dibelanjakan pada februari dan sisanya persen pada bulan maret katanya sementara di lain pihak pks menampilkan strategi iklan yang lebih kreatif dengan sedikit iklan di televisi tetapi memperbanyak kerja sosial baksos di tengah masyarakat presiden pks tifatul sembiring mengakui ketiadaan modal besar membuat pks harus ekstra kreatif dalam beriklan karena keterbatasan dana itu pula pks hanya menayangkan iklan hanya beberapa hari saja “punya miliar rupiah saja sudah bagus” ujar tifatul sambil tertawa jika rata rata biaya beriklan secara excessive di sebuah stasiun tv per harinya adalah rp juta maka per bulan adalah rp milyar sutrisno bachir dan rizal malarangeng adalah contoh dua calon yang beriklan di tv secara excessive ketua umum pan menghamburkan uang sampai rp miliar untuk beriklan itu hanya untuk satu stasiun tv saja silakan kalikan dengan stasiun tv misalnya angka ini hanya untuk di media tv belum termasuk media lain seperti radio internet bioskop baliho spanduk bendera kalender brosur kaos dan material kampanye lainnya kampanye tahap awal ini hanya sekadar untuk menciptakan awareness untuk billboard berukuran sekitar meter persegi biayanya sekitar rp juta tergantung wilayah selama setahun belum lagi biaya pengerjaan yang dikeluarkan asumsikan seorang politisi atau parpol memasang papan iklan seluas meter persegi di satu kabupaten selama bulan dengan hitungan kasar maka ia akan mengeluarkan biaya sekitar rp juta untuk media cetak sebuah koran nasional bergengsi mematok tarif rp juta untuk satu halaman penuh hitam putih jika iklan muncul dalam warna tarifnya rp juta iklan berwarna di halaman satu lebih mahal lagi karena sifatnya yang eye catching dan bisa mencapai rp juta untuk ukuran kecil saja sementara iklan satu halaman penuh di harian kompas bisa menghabiskan lebih dari rp juta untuk biaya iklan di televisi seorang sutrisno bachir menurut kabar menghabiskan sekitar rp milyar setiap bulannya untuk daerah jakarta satu spot di televisi berdurasi detik paling murah rp juta untuk talk show selama satu jam seorang politisi minimal harus mengeluarkan rp miliar menurut associate media director hotline advertising zainul muhtadin bahwa pada pemilu biaya iklan kampanye rp miliar per calon tetapi saat ini minimal setiap calon harus menyiapkan rp miliar televisi masih akan menjadi pilihan utama penempatan iklan kampanye sekitar persen target audiens bisa di cover oleh televisi biaya ratusan milyar rupiah habis dalam beberapa bulan saja jadi bayangkan dalam tahun berapa baiaya yang dikeluarkan oleh seorang calon pemimpin di negeri ini dan berapa biaya yang dikeluarkan oleh beberapa orang calon misalnya orang calon lebih dari rp trilyuniklan juga disinyalir banyak yang dibiayai oleh uang panas seperti dari hasil pencucian uang atau sumbangan pengusaha hitam sebab keadaan ini akan membuat kandidat yang mengiklankan diri itu jika terpilih akan lebih mengabdi kepada kepentingan pengusaha hitam yang menyumbangnya dibandingkan dengan rakyat ironisnya data minimal tentang sumber dana untuk iklan dan berapa besarnya ini masih termasuk data yang sulit dicari pengamat politik indria samego juga mempertanyakan transparansi dana dari parpol yang beriklan yang menurutnya sangat rentan dengan praktik penyelewengan penyelewengan ini juga akan sangat rentan sekali ketika pemilik televisi atau media massa menjadi partisan atau pengurus sebuah parpol andrian sulistyono jakarta selatan asusgmail com
639722	koperasi usu gugat	medan koperasi pengembangan universitas sumatera utara kp usu menggugat bupati mandailing natal karena menerbitkan sk pembatalan izin usaha perkebunan iup seluas ribu hektare milik koperasi tersebut mereka menggandeng kantor hukum adnan buyung nasution saat ajukan gugatan itu berbicara kepada wartawan di medan selasa adnan buyung menyatakan gugatan itu sudah diajukan ke pengadilan tata usaha negara ptun medan proses sidang juga tengah berjalan pokok persoalannya adalah kebijakan bupati mandailing natal itu dianggap sepihak dan sangat merugikan koperasi sudah menanamkan investasi cukup besar namun secara sewenang wenang izinnya dibatalkan bupati kita berharap hakim dalam putusan selanya menunda sk itu kata buyung didampingi koleganya m sadly hasibuan dan pia ar akbar nasution disebutkan buyung kp usu yang dimotori mantan rektor usu chairuddin p lubis pada desember memperoleh izin prinsip dari menteri kehutanan dan perkebunan dalam usaha budidaya perkebunan kelapa sawit luasnya mencapai ribu hektare rencananya lahan itu untuk kepentingan kebun percobaan dan hasilnya untuk membiayai berbagai aktivitas di usu seperti beasiswa mahasiswa dan sebagainya persetujuan pencadangan areal hutan untuk hak pengusahaan perkebunan dikeluarkan menteri kehutanan dan perkebunan tahun gubernur juga mengeluarkan persetujuan pada tahun yang sama lahannya berada di kecamatan muara batang gadis kabupaten mandailing natal menyusul izin tersebut kp usu kemudian melakukan pengolahan lahan pembibitan sawit dilakukan di lahan sekitar hektare dari ribu hektar izin prinsip baru hektare lahan yang sudah diterbitkan peta bidang tanah nya oleh badan pertanahan nasional namun tiba tiba bupati mandailing natal hidayat batubara menolak permohonan perpanjangan sk izin lokasi kp usu pada mei bahkan pada juni menerbitkan sk pencabutan iup yang pada pokoknya mencabut sk iup milik kp usu tanpa sk iup praktis kp usu tidak dapat melanjutkan kegiatan usaha perkebunan kelapa sawit di sana ujar buyung pencabutan izin inilah yang digugat ke ptun dalam pertimbangan terhadap hakim kp usu menyatakan sudah menanamkan investasi sebesar rp miliar untuk melakukan serangkaian langkah pembebasan lahan kemudian membuka akses jalan sepanjang kilometer ke areal kebun kendati ada upaya gugatan ini kami masih terbuka untuk upaya damai tukas buyung
481123	lapsus	jakarta penjaringan capres golkar mulai dibuka sejumlah nama akan dijaring untuk di survei diantara nama nama kandidat yang bakal menjadi calon kuat capres dari golkar adalah sri sultan hamengkubuwono x dan jusuf kalla jk dari sejumlah dpd dikabarkan dukungan terhadap sultan semakin menguat meski demikian sultan mengaku masih mengamati perkembangan di internal golkar kita tunggu saja hasil rapimnas partai golkar sekarang saya belum tahu bagaimana mekanisme penjaringan capresnya kata sultan seusai membuka acara pameran te collabo di yogyakarta senin februari sinuhun juga mengaku tidak berharap banyak dengan penjaringan capres versi golkar saat ini sebab ia merasa sudah mendapat dukungan dari sejumlah partai selain golkar dengan kata lain sultan enggan disebut menaruh harapan banyak kepada partai tempatnya bernaung kita tunggu saja hasil pemilu april dan rapimnas golkar elak sultansikap sultan tersebut jauh berbeda dengan pernyataan sejumlah pendukung sultan di internal golkar beberapa kader golkar sebelumnya mengatakan penjaringan capres oleh partai golkar akan membuka peluang sultan untuk maju sebagai kandidat unggulan tapi kata ketua departemen tenaga kerja dan transmigrasi partai golkar zainal bintang peta persaingan saat ini berubah ketika jk sudah merestui adanya penjaringan capres sebab bila jk benar benar ingin masuk dalam bursa capres kemungkinan peluangnya lebih besar dibanding sultan kalau jk mengatakan siap sebagai capres maka secara fatsoen politik dukungan dpd akan berubah tapi apakah jk berani menyatakan diri maju sebagai capres itu yang sedang ditunggu ungkap bintang dikatakan zainal desakan penjaringan capres oleh sejumlah dpd salah satunya untuk mendesak jk mengambil peluang menjadi capres nah ibarat main bola biliar imbuh zainal jk sebenarnya bisa memasukan tiga bola sekaligus maksudnya dengan menyatakan diri siap sebagai capres posisinya akan semakin menguat di dpd dan akan merontokan para pesaingnya di golkar termasuk sultan sebab seadainya jk bilang siap maju maka semangat kader akan bangkit dengan mendukung ketua umum sebagai capres tapi apakah jk berani menyatakan dirinya untuk maju sebagai capres itulah yang kita tunggu dan kami berharap jk berani menyatakan siap maju sebagai capres harap zainal begitu juga yang dikatakan pengamat politik muhammad qodari dari indo barometer kata qodari jika jk berani mengatakan siap maju sebagai capres peta politik akan geger sebab sama saja mengumumkan pecah kongsi dengan sby itu sebabnya qodari menilai dukungan jk terhadap penjaringan capres hanya untuk meningkatkan daya tawarnya kepada partai demokrat saat ini jk berharap garansi yang menguntungkan dari sby jika tidak ada garansi itu jk bisa saja maju sebagai capres jelas qodaripeluang jk untuk jadi capres dari golkar pun sangat besar sebab sebagai ketua umum jk punya akses ke dpd dpd hal ini memudahkannya untuk melakukan konsolidasi sementara sultan kata qodari hanya didukung oleh jajaran elit yang kurang punya pengaruh di partai jadi peluangnya sangat tipis meski demikian sultan bisa menjadi pesaing yang berat sekalipun ia menjadi capres dari partai lain kondisi seperti ini disebut sebut seperti pada pemilu saat itu wiranto yang didukung golkar tidak berdaya menghadapi pasangan mega hasyim muzadi dan sby jk ketika golkar merasa tidak punya peluang sebagai pemenang sejumlah elit kemudian menyeberang ke jk yang merupakan kader golkar akankah kondisi serupa terulang kata qodari semua bisa saja terjadi tapi persoalannya suara dukungan sebagai capres tidak serendah pemilu saat ini untuk maju sebagai capres paling tidak harus mengantongi suara dukungan parpol sebanyak persen hal inilah yang akan sulit dilakukan sultan harapan yang paling mungkin adalah sultan maju sebagai capres dari partai golkar apalagi kata wakil ketua umum golkar agung laksono meski menjabat ketua umum partai golkar jk tidak otomatis menjadi capres golkar sebab model penjaringan yang dilakukan adalah melalui survei dpp partai golkar akan menyerahkan nama tertinggi yang diusulkan ke lembaga survei ketujuh nama itu kemudian akan di survei popularitasnya di masyarakat bukan di internal partai nama yang menguat di survei akan dibawa ke rapimnas untuk ditetapkan dengan demikian posisi jk dan sultan sama sama kuat lalu siapa yang akan jadi pemenangnya kita tunggu saja
639746	taksi anak-anak	jakarta anak anak naik taksi tanpa orang tua kenapa tidak ada beberapa tips agar anak anak aman naik taksi sendiri pertama order melalui telepon atau order by online itu adalah tips paling aman ujar vice president blue bird noni sa purnomo dalam acara safety riding keselamatan menggunakan taksi di taman lalu lintas cibubur bumi perkemahan cibubur jakarta timur selasa menurut noni dengan memesan melalui telepon atau online maka rute taksi akan disimpan bila terjadi hal hal yang tidak diinginkan maka dapat dilacak seperti barang ketinggalan atau emergency case lainnya kata dia noni juga menyarankan agar orang tua dan anak mencatat nomor taksi yang akan mengantar anak hal ini untuk mengetahui identitas pengemudi taksi untuk pembayaran orang tua bisa memberikan pada anak voucher taksi setelah diisi anak memberikannya pada sopir dan sopir memberikan ke perusahaan lalu nanti dari perusahaan akan mengklaim ke ortunya ini salah satu cara aman untuk anak kecil nggak mungkin anak kecil bawa uang tunai banyak ucapnya sementara untuk memantau keberadaan anak orang tua dapat melihat dari aplikasi mobile yang sudah dipasang di taksi bisa dilihat di google map keberadaan anak juga bisa diketahui teknologi ini sudah kita pakai satu tahun belakangan data pengemudi kecepatan berapa dapat diketahui tapi sekarang hanya ada di semarang dan jakarta nanti akan ada di medan dan surabaya beber noni noni menuturkan umur minimal anak anak aman naik taksi sendiri yakni tahun karena pada umur itu anak sudah mengerti konsep uang sekarang sudah banyak orang tua yang titipin anaknya ke taksi sejauh ini belum ada kejadian yang buruk ujar noni dalam acara itu blue bird mengundang anak dari provinsi seluruh indonesia mereka dipilih berdasarkan pengalaman mereka naik taksi yang dimuat di majalah bobo mereka diajak mengenal taksi misalnya tentang argometer dan identitas sopir anak anak yang rata rata berusia tahun mengikuti dengan gembira mereka mengenakan seragam yang dibagikan panitia ke depannya anak anak itu akan menjadi duta keselamatan selama tahun anak anak akan memberi tahu cara menumpang taksi yang aman kepada rekan rekan mereka
481432	TNI panser	bandung namanya dicomot dari mamalia khas sulawesi tampilannya tidak kalah sangardengan panser sejenis dari eropa itulah sosok anoa panser beroda hasil karya anak bangsa kelahirannya disiapkan untuk mewujudkan kemandirian di bidang alutsista oleh departemen pertahanan dan pt pindad apa saja kelebihan anoa untuk ukuran panser anoa terbilang cukup cepat kendaraan tempur ranpur ini mampu melaju hingga kecepatan km per jam anoa juga mampu melompati parit selebar meter dan melahap tanjakan dengan kemiringan derajat untuk urusan bodi anoa dilapisi lapisan baja tahan peluru apabila diberondong senapan ak atau m sih dijamin tidak bakal tembus suspensi juga terbilang empuk independent modular dan torsion bar selain itu sistem navigasi generasi terbaru ditambah alat komunikasi anti jamming melengkapi interior ranpur ini sayangnya pt pindad belum sepenuhnya mandiri beberapa komponen masih dicomot dari pabrikan renault di perancis namun bukan mimpi belaka jika ke depannya pt pindad optimis ke depan seluruh komponen merupakan hasil dalam negeri untuk mesin automatic transmision dan suspensi masih dari renault ujar dirut pt pindad adik a soedarsono saat jumpa pers usai menyerahkan panser x kepada dephan di kantor pt pindad kiara condong bandung jumat selain mesin baja pada panser pertama masih diimpor dari luar tetapiselanjutnya pt krakatau steel siap memenuhi kebutuhan baja sang anoa ranpur ini bisa digunakan untuk bermacam fungsi mulai dari pembawa pasukan kendaraan komando hingga rumah sakit berjalan di medan tempur persenjataan yang sudah terpasang adalah senapan mesin mm dan mm untuk varian infanteri dan automotic granade launcher agl mm untuk varian kavaleri departemen pertahanan telah mengalokasikan dana rp triliun untuk pembelian ranpur anoa ini seluruh produksi diharapkan bisa selesai pada tahun ini direktur jenderal sarana pertahanan dephan marsekal muda eris herryanto di pt pindad menjelaskan karena panser ini merupakan buatan luar negeri maka dijamin kondisinya cocok untuk medan operasi di tanah air
481855	narkoba	jakarta selintas kampung ambon seperti perkampungan warga perantauan di jakarta lainnya padat dan sedikit homogen dari sisi etnis sejumlah pemuda berwajah khas timur indonesia berlalu lalang dari gang ke gang puluhan ekor anjing turut meramaikan jalan utama di jl safir mirah dan kristal kita tinggal di sini sejak puluhan tahun lalu kata wakil ketua rw kedaung cengkareng jakarta barat jimmy pasania senin menurut pasania kampung ambon mulai ramai saat perkampungan ambon di sekitar di kwitang jakpus digerus petugas para perantau asal ambol memilih minggir ke daerah kedaung di tepi sungai cengkareng drain kami semua patuh hukum tidak benar ada pandangan di kampung ini sarang narkoba sangkal pasania saat dimintai tanggapan tentang kampungnya namun pandangan miring warga luar terhadap kampungnya sangat terasa sepanjang cengkareng drain saat mencari alamat tersebut di ujung jalan daan mogot sejumlah pengojek yang ditanya langsung berubah air muka mereka terlihat serius dan sedikit takut kemudian memberi petunjuk arah dengan sekenanya konon di kampung ambon siapa saja bebas bertransaksi narkoba peredaran barang haram tersebut berjalan rapi karena disusun oleh semua warga masyarakat dan semuanya saling melengkapi dari tukang ojek petugas keamanan ibu ibu pemuda dan si pengedar sendiri saking rapinya razia narkoba di lokasi ini harus dilakukan sampai level polda dan mabes polri kalau hanya setingkat polsek atau polres polisi memilih putar balik daripada digebuki warga yang meneriaki maling ini memang target utama kami sarang narkoba ucap sekretaris badan narkotika kotamadya bnk jakarta barat suhardin mendirikan posko antinarkoba di sarang penjahat membutuhkan tenaga ekstra bnk perlu mengajak polisi satpol pp tni dan aparat birokrasi di lapangan total jenderal jumlah petugas yang diturunkan mencapai ratusan petugas menggunakan truk untuk memobilasi kekuatan juga kendaraan dinas lapangan yang jumlahnya berderat memanjang sekitar meter di pinggiran kali cengkareng drain kami tidak ingin kecolongan ini harus dibangun untuk meminimalisir peredaran narkoba sergah suhardin
639826	Jokowi Pilgub DKI Mega Prabowo Pilpres 2014	jakarta nama joko widodo jokowi yang membawa gaya baru memimpin dki jakarta mulai membuat panas elite politik tanah air jika dia sukses memimpin jakarta selama lima tahun penuh jokowi diprediksi tak terbendung di pilpres jokowi ini sebetulnya satu pemimpin yang berbeda yang elektabilitasnya itu sangat tinggi jadi kalau dia memaintenance harapan publik tahun di dki dan dia sukses plus dia tidak tergoda bertarung di maka sebetulnya nilai jual jokowi akan semakin meroket prediksi saya tahun kalau dia maju tidak ada tokoh yang bisa membendung dia kata pengamat politik dari uin jakarta gun gun heryanto saat berbincang dengan jumat gun memprediksi di pemilu nanti saja akan banyak tawaran untuk jokowi asalkan dia bisa menjaga etos kerja yang tak kenal lelah dan dekat dengan rakyat namun jokowi harus mampu menolak semua tawaran tersebut demi masa depan politik yang lebih cerah sekali lagi dia harus berani mengatakan tidak kepada tokoh yang akan mengusungnya dia harus betul betul jaga benar untuk no untuk maju di karena kemungkinannya di dia akan ditarik tarik untuk masuk ke rivalitas kompetisi katanya jokowi justru harus menuntaskan semua permasalahan di jakarta terlebih dahulu bagaimana pun kesuksesan membereskan jakarta akan menjadi modal penting lantaran semua mata tertuju ke ibu kota dia harus menunjukkan semacam parameter kepemimpinannya dianggap sukses dki jakarta lima tahun ini dan terpilih lagi di pilgub berikutnya saya yakin jokowi akan leading di katanya dia harus menunjukkan bahwa dia on the track menjadikan jakarta baru kalau dia bisa lakukan sampai maka nggak ada lawan yang kuat di nanti pdip pun tak punya alasan untuk tidak mencalonkan dia tegasnya
639832	pohon tumbang	cirebon sebuah pohon besar tumbang dan menimpa pengguna jalan di jl pilang raya tepat di depan markas komando artileri pertahanan udara sedang cirebon satu orang tewas dan satu mengalami luka di bagian kepala korban tewas adalah wahyu maulana warga jl diponegoro kota cirebon sedangkan korban luka adalahyadi th warga desa setu kecamatan weru cirebon lalu lintas tidak begitu ramai tiba tiba pohon tumbang ke jalan korban tewas tertimpa cabang pohon ang besar tepat di bagian wajah sempat terseret sekitar meter ujar nurkholis anggota tni arhanudse jumat menggunakan mobil ambulans arhanudse kedua korban langsung dibawa ke rs ciremai saat itu nyawa wahyu sudah tidak tertolong sementara korban luka sobek pada bagian kepala sepanjang cm tidak ada angin tidak ada hujan tapi rupanya akar pohon sudah rapuh sehingga tidak kuat menahan dahan yang besar besar tambah nurkholis korban tewas adalah karyawan peternakan alido yang berkantor di perumahan cempaka arum jl cakrabuana sumber cirebon saat itu korban hendak berangkat kerja
639881	jokowi dki	jakarta sambil menenteng lukisan selebar meter sutanto bergegas berjalan kaki ke kediaman dinas joko widodo sutanto berniat menemui orang nomor satu di jakarta itu dengan berbatik sutanto datang dari rumahnya di kelapa gading jakarta utara dia menumpang kereta dan turun di stasiun cikini jakarta pusat dari stasiun sutanto harus berjalan kaki ke kediaman jokowi nggak ada uang katanya sabtu setelah menunggu sekitar jam sutanto akhirnya memberanikan diri menghampiri pintu gerbang kediaman jokowi saya ingin ketemu dan memberikan lukisan ujarnya sambil memamerkan lukisan yang dibawanya lukisan ini dibuat sutanto sebagai bentuk kebanggaannya terhadap jokowi yang kini menjadi gubernur jakarta karena simpatik sama gubernur waktu pemilihan saya doakan dan sukses ternyata jadi lukisan ini untik melampiaskan kegembiraan tuturnya pria berperawakan kurus dengan rambut mulai memutih ini melukiskan sesosok perempuan mobil antik ditambah sekumpulan orang dalam lukisan juga tertulis selamat datang pak jokowi dan pak ahok kita bersatu untuk indonesia sutanto tetap ngotot bertemu jokowi meski penjaga rumah meminta dirinya datang ke balai kota lantaran jokowi tidak pernah menerima barang ketika berada di kediaman saya mau bertemu saya kehabisan dana katanya tak berselang lama david ajudan jokowi menemui sutanto untuk menerima lukisan yang dibawa tak cuma itu david juga meminta alamat dan nomor telepon sutanto
639924	menhub mudik	jakarta menteri perhubungan ee mangindaan hari ini melakukan inspeksi mendadak sidak di terminal kalideres menteri dari partai demokrat ini memberikan catatan pada fasilitas ruang tunggu terminal menumpang kendaraan dinasnya toyota royal saloon ri mangindaan dan rombongan tiba di terminal kalideres jakarta barat pukul wib senin mangindaan langsung keluar mobil dan menyambangi tempat parkiran terminal di sini dia sempat berbincang bincang dengan petugas parkir siapa saja yang parkir di sini tanya mangindaan yang berbaju seragam dinas kemenhub warna biru banyak pak orang dari tangerang juga nitip di sini kemudian mereka naik busway jawab salah seorang petugas parkir tak lama kemudian mangindaan mengecek ke fasilitas terminal lainnya toilet tempat pembuangan sampah dan ruang menunggu bagi penumpang bus antarkota antarprovinsi akap berdasarkan pantauan di ruang tunggu penumpang yang panjangnya sekitar meter itu suasananya sangat penuh dan sesak banyak penumpang yang tidak mendapat tempat duduk dan terpaksa lesehan sementara tas tas mereka yang berukuran besar juga menyita ruang di tempat tunggu itu hal ini ternyata juga dicatat oleh ee mangindaan kepada wartawan setelah sidak selama menit di terminal kalideres mantan menteri pan ini menyatakan ruang tunggu terminal memang masih perlu dibenahi penjualan tiket dan ruang tunggu terlalu sumpek perlu kita tingkatkan ujar mangindaan menurut mangindaan perlu dilakukan pemisahan antara ruang tunggu dengan tempat pedagang dia memiliki rencana untuk membuat dua lokasi itu dalam lantai yang terpisah nanti dibuat di atas buat jualan dan bawah untuk tiket dan ruang tunggu ditampung supaya lebih manusiawi sekarang sudah manusiawi namun kalau pas lebaran penuh sekali malam minggu juga penuh ujarnya sedangkan untuk fasilitas terminal seperti toilet tempat pembuangan sampah dan juga tempat parkir mangindaan menilai fasilitas fasilotas itu sudah bagus tapi ruang kesehatan juga seharusnya ada pungkas mangindaan memberi catatan tambahan
